{
  "schema_version": "0.1.0",
  "event_id": "00000000-0000-4000-8000-000000000001",
  "occurred_at": "2026-10-12T00:00:01Z",
  "observed_at": "2026-10-12T00:00:02Z",
  "component": "hangang",
  "instance_id": "example-instance-01",
  "event_type": "decision",
  "outcome": "allow",
  "reason_code": "resource-grant",
  "resource_id": "finance.reports",
  "action": "read",
  "request_id": "example-request-01",
  "revisions": {
    "authority_epoch": "example-authority-01",
    "catalog": 1,
    "policy": 1,
    "identity": 1,
    "network": 1
  },
  "latency_us": 250
}
